Recipe_Name,Review_Count,Author,Prepare_Time,Cook_Time,Total_Time,Ingredients,Directions,RecipeID,Recipe_Photo
Blizzard Cake Recipe ,70,JGP,X,X,X,"ice cream,chocolate,topping thawed",Soften ice cream. Crush cookies by placing them in a large zip lock bag and rolling over them with a rolling pin. Mix softened ice cream and crushed cookies together. Fold in the whipped topping and pour into one 9x13 inch glass pan. Freeze for 2 hours then serve.**,7728,https://images.media-allrecipes.com/userphotos/560x315/6190869.jpg
Self,23,Cathy,X,X,X,"cake,cream cheese,white sugar,egg,salt,chocolate","Preheat oven to 350 degrees F (175 degrees C). Lightly grease muffin pans.**Prepare cake mix according to package directions.**Combine cream cheese and sugar, cream until light and fluffy. Add egg and salt, beating well.**Spoon batter into greased muffin pans filling 2/3 full. Drop a few semisweet chocolate morsels in the center and spoon 1 teaspoon of the cream cheese mixture on top of the chocolate morsels.**Bake at 350 degrees F (175 degrees C) for 25 minutes. Let cupcakes cool before serving.**",7729,https://images.media-allrecipes.com/userphotos/560x315/13449.jpg
Caramel Raisin Cheesecake Recipe ,0,Star Pooley,X,X,X,"raisin,water,cookie,white sugar,butter,cream cheese,vanilla,egg,ice cream","Preheat oven to 325 degrees F (165 degrees C).**Combine raisins and water in a microwave safe bowl, cover and microwave on high for 3 minutes. Let stand for 20 minutes then drain.**Melt the butter or margarine. Combine cookie crumbs, 1/4 cup of the white sugar, and the melted butter or margarine. Press  the cookie crumb mixture into the bottom of one 9 inch springform pan. Set aside 1 cup of the raisins for the topping. Sprinkle the remaining raisins evenly over the crust.**In a large bowl beat the cream cheese until light. Gradually beat in the remaining 2/3 cup of white sugar. Beat in the eggs and the vanilla. Pour cream cheese mixture over raisins and crust.**Bake at 325 degrees F (165 degrees C) for 55 minutes. Turn off oven and leave oven door ajar for 1 hour. Remove cake from oven and let cool completely. Cover and refrigerate for 4 hours or overnight. To serve, combine remaining raisins and caramel or butterscotch topping. Spread over the top of the cake. Makes 12 servings.**",7730,https://images.media-allrecipes.com/images/79591.png
Carrot Fruit Ring Recipe ,8,Carol,X,X,X,"vegetable oil,white sugar,brown sugar,egg,carrot,flour,baking powder,baking soda,cinnamon,salt,raisin,cherry,fruit,date,walnut,flour","Preheat oven to 325 degrees F (165 degrees C). Grease and flour one 10 inch  tube pan.**Beat the vegetable oil with the white and brown sugars. Beat in the eggs one at a time. Stir in the grated carrots. Add the 2/12 cups flour, baking soda, baking powder,  ground cinnamon, and salt.  Stir until just moistened.**Toss the raisins, candied cherries, candied mixed fruit, chopped dates, and the chopped walnuts with the remaining 1/2 cup flour. Stir to coat. Add fruit and nut mixture to the batter and stir until combined. Pour batter into the prepared pan.**Bake at 325 degrees F (165 degrees C) for 1 1/2 hours.**",7731,https://images.media-allrecipes.com/images/79591.png
Banana Cake III Recipe ,40,Sally E. Forsythe,X,X,X,"white sugar,flour,baking soda,water,banana,salt,mayonnaise,cream cheese,butter,sugar,vanilla,walnut","Preheat oven to 350 degrees F (175 degrees C).  Lightly grease two 9 inch round pans.**Combine sugar, flour, baking soda, water, mashed bananas, salt, and mayonnaise.  Mix together, and pour into the cake pans.**Bake cake about 45 minutes, or until a toothpick inserted in the center comes out clean.  Remove from oven, and cool on wire racks.**In a mixing bowl, blend cream cheese and butter or margarine together.  Gradually add sugar and vanilla, and mix well.   Stir in nuts.  Fill and frost the cake.**",7732,https://images.media-allrecipes.com/userphotos/560x315/2985147.jpg
Apricot Brandy Pound Cake I Recipe ,34,Joyce Carcara,X,X,X,"cake,sour cream,apricot,vanilla,orange,lemon,almond,vanilla,egg","Preheat oven to 350 degrees F (175 degrees C).  Grease and lightly flour a bundt pan.**In a large bowl, beat cake mix, pudding, and eggs until smooth.  Mix brandy and flavorings in sour cream, and add to egg mixture.  Beat at least 2 minutes with an electric mixer on medium speed.  Pour batter into prepared pan**Bake for 50 to 55 minutes, or until tester inserted in the center comes out clean.  Cool cake in pan on wire rack for 20 minutes.  Remove from pan, and continue cooling on wire rack.**",7734,https://images.media-allrecipes.com/userphotos/250x250/247158.jpg
German Chocolate Cake I Recipe ,18,Sally,X,X,X,"flour,white sugar,baking powder,baking soda,salt,butter,buttermilk,vanilla,chocolate,egg,buttermilk,coconut,brown sugar,cream,walnut,butter","Preheat oven to 350 degrees F (175 degrees C). Grease and flour one 9 inch square cake pan. Sift the cake flour, 1 cup white sugar, baking powder, baking soda, and salt together.**Cream 1/3 cup of the butter or margarine. Stir in 3/8 cup buttermilk and 1 teaspoon vanilla. Blend in the flour mixture and beat with an electric mixer on medium speed for 2 minutes. Add the melted and cooled German sweet chocolate, eggs, and the remaining 3/8 cup buttermilk. Continue to beat at medium speed for another minute more. Pour batter into the prepared pan.**Bake at 350 degrees F (175 degrees C) for 40 minutes. Cool in pan for 15 minutes then frost.**To Make Frosting: Combine the coconut, brown sugar, cream, chopped nuts, 1/4 cup butter or margarine. Mix until of a spreadable consistency. Spread over top of baked cake. Broil 3 inches from heat until browned (about 3 minutes). Serve cake warm or cold.**",7735,https://images.media-allrecipes.com/userphotos/250x250/982908.jpg
Chocolate Cheese Frosting Recipe ,266,Carol,15 m,X,15 m,"cream cheese,milk,sugar,butter,vanilla,cocoa powder,cinnamon","^In a bowl, beat together the cream cheese, 3 tablespoons milk, confectioner^^s sugar, butter, vanilla, cocoa, and cinnamon to a spreadable consistency. Beat in additional milk if necessary. For a darker frosting add more cocoa or up to 4 ounces melted chocolate. Spread onto cooled cake.**^",7737,https://images.media-allrecipes.com/userphotos/560x315/959551.jpg
Almond Coconut Chocolate Cake Recipe ,142,Leslie Tx,20 m,40 m,1 h,"cake,milk,white sugar,marshmallow,coconut,butter,chocolate,almond","Mix cake mix and bake as directed for one 9x13 inch cake.**In a saucepan combine 1/2 of the evaporated milk, and 1-1/2 cups of the sugar. Bring mixture to a rapid boil. Quickly remove from the heat and add marshmallows. Stir until melted. Stir in coconut. Pour mixture over the top of the baked cake.**In a saucepan combine the remaining sugar and the remaining evaporated milk. Bring to a boil. Remove from heat and add butter and chocolate chips. Stir until melted. Mix in toasted almonds. Pour mixture over the top of the coconut topped cake. Chill for at least 2 hours before serving. Cake tastes best if baked the day before.**",7738,https://images.media-allrecipes.com/userphotos/250x250/981137.jpg
Coconut Chocolate Cake I Recipe ,38,Leslie Tx,X,X,X,"chocolate,white sugar,butter,milk,marshmallow,coconut,cocoa powder,sugar,vanilla","^Mix and bake cake mix as directed for two 8 or 9 inch layers. Let layers cool then split each one in half horizontally to make a total of 4 layers.**In a saucepan over medium heat mix together the white sugar, butter or margarine, and 1/2 cup of the evaporated milk. Cook for 10 minutes. Stir in the marshmallows and mix until smooth. Stir in the coconut. Spread the filling between the cake layers.**Mix together the cocoa, remaining 1/4 cup evaporated milk, the confectioner^^s sugar, and the vanilla. Beat until smooth and spread over top and sides of cake.**^",7739,https://images.media-allrecipes.com/userphotos/250x250/201613.jpg
Marzipan Recipe ,17,Carol,30 m,X,1 d,"sugar,almond,egg,salt,almond","^Blend the confectioner^^s sugar, finely ground almonds, egg whites, salt ,and almond extract in a blender until perfectly blended.  Chill covered 24 hours to harden.**^",7740,https://images.media-allrecipes.com/userphotos/560x315/4027760.jpg
Banana Split Cheesecake Recipe ,115,Peggy,X,X,X,"ham,butter,sugar,cream cheese,pineapple,banana,topping thawed,cherry,chocolate,pecan",^Blend the melted butter or margarine with the graham crackers and press into the bottom of one 9x12 inch pan.**Blend the confectioner^^s sugar and the cream cheese together until smooth. Spread over the graham cracker crumb layer. Layer the crushed pineapple and the bananas over the cream cheese layer. Then spread the whipped topping over the top. Decorate with maraschino cherry halves. Drizzle chocolate syrup over the top and sprinkle with pecans. Chill for at least 4 hours then serve.**^,7741,https://images.media-allrecipes.com/userphotos/560x315/2573636.jpg
Apple Dump Cake Recipe ,33,CHI CHI,X,X,X,"apple,cinnamon,butter,cinnamon",Preheat oven to 350 degrees F (175 degrees C). Grease one 9x13 inch baking pan**Mix apple pie filling with ground cinnamon to taste. Pour mixture into pan. Sprinkle apples and cinnamon mixture over top of apples.**In a small saucepan melt the butter or margarine and pour evenly over the top of the cake. Sprinkle with additional cinnamon if desired.**Bake at 350 degrees F (175 degrees C) for 20 minutes or until golden brown. Serve hot with ice cream!**,7742,https://images.media-allrecipes.com/userphotos/250x250/505021.jpg
Watergate Cake I Recipe ,11,Suzanne Stull,X,X,X,"cake,pistachio,vegetable oil,water,egg,walnut,milk,dessert,walnut,cherry","Preheat oven to 350 degrees F (175 degrees C). Grease and flour one 9x13 inch pan.**Combine the cake mix, 1 box of the instant pistachio pudding, the vegetable oil, club soda, eggs, and 1/2 cup of the chopped walnuts. Stir until just combined and pour into the prepared pan.**Bake at 350 degrees F (175 degrees C) for 45 minutes. Let cake cool then frost.**To Make Frosting: Beat the milk into the remaining box of pistachio pudding. Prepare topping mix according to package directions. Fold into pudding mixture. Spread over top of cooled cake and sprinkle with walnuts and maraschino cherries.**",7743,https://images.media-allrecipes.com/userphotos/250x250/192316.jpg
Toasted Butter Pecan Cake Recipe ,13,Carol,X,X,X,"butter,pecan,flour,baking powder,salt,white sugar,egg,milk,vanilla,butter,vanilla,salt,sugar,cream","^Grease and flour the bottoms of three 9 inch layer pans.  Preheat oven to 350 degrees F (175 degrees C).**Melt 1/4 cup butter or margarine in a heavy skillet over medium heat.  Add pecans, and brown for 10 to 15 minutes, stirring frequently.**Cream 1 cup butter or margarine in large mixing bowl. Gradually add 2 cups white sugar, and cream until light and fluffy with mixer on high speed.  Blend in eggs one at a time, beating well on medium speed after each addition.  Sift together flour, baking powder, and 1/2 teaspoon salt.  At low speed add sifted ingredients alternately with milk and vanilla extract, beginning and ending with dry ingredients.  Blend well after each addition.  Stir in 1 1/3 cups of the toasted pecans.  Pour batter into pans.**Bake at 350 degrees F (175 degrees C) for 25 to 30 minutes, until cake is golden brown and springs back when lightly touched in center.**To Make Frosting:  Cream 1/4 cup butter in mixing bowl.  Add 1 teaspoon vanilla extract, 1/4 teaspoon salt, confectioners^^ sugar and cream. Beat until smooth and of spreading consistency.  If necessary, thin with additional cream.   Blend remaining 2/3 cup pecans into frosting.  Fill and frost the cake.**^",7745,https://images.media-allrecipes.com/userphotos/250x250/130219.jpg
^Aunt Mary^^s Vanilla Frosting Recipe ^,69,Leo J. Lagrotte,X,X,X,"butter,shortening,sugar,milk,flour,vanilla","^Combine butter or margarine, shortening, confectioners^^ sugar, flour, vanilla, and milk in a mixing bowl.  Whip all ingredients until fluffy.**^",7748,https://images.media-allrecipes.com/userphotos/560x315/4356898.jpg
^Cookies ^^n Cream Cake Recipe ^,182,Suzanne Stull,30 m,35 m,1 h 25 m,"cake,water,vegetable oil,egg,chocolate,sugar,shortening,vanilla,egg,chocolate","^Preheat oven to 350 degrees F (175 degrees C). Grease and flour two 9 inch round cake pans.**In a large bowl, mix the cake mix, water, oil, and 3 egg whites with an electric mixer on high speed for 2 minutes. Gently stir in crushed cookies. Pour batter into the prepared pans.**Bake for 25 to 35 minutes in the preheated oven, or until a knife inserted in the center of the cake comes out clean. Cool 10 minutes in pans. Remove from pans, and completely cool on racks.**To Make Frosting:  In a small bowl, thoroughly blend the 1/2 cup confectioners^^ sugar, shortening, vanilla, and 2 egg whites. Beat in remaining confectioners^^ sugar until creamy. Frost the cake, and garnish with remaining cookies.**^",7749,https://images.media-allrecipes.com/userphotos/560x315/85461.jpg
Holiday Refrigerator Cake Recipe ,2,Carol,X,X,X,"marshmallow,whipping cream,ham,cherry,pineapple,date,pecan,orange,sherry","Heat marshmallows and cream over low heat, folding over and over until marshmallows are half melted.  Remove from heat, and continue folding until mixture is smooth and fluffy.  Cool.**Add 3/4 cup graham cracker crumbs, fruit, nuts, orange rind and sherry to the marshmallows.  Stir to combine.**Sprinkle a buttered loaf pan with 1/4 cup graham cracker crumbs, then pour the marshmallow concoction over crumbs.  Chill thoroughly.**",7750,https://images.media-allrecipes.com/images/79591.png
Cherry Nut Snow Cake Recipe ,1,Carol,30 m,1 h,1 h 30 m,"flour,baking powder,salt,white sugar,shortening,milk,vanilla,almond,egg,walnut,cherry,nut,cherry","Preheat the oven to 350 degrees F (175 degrees C).  Line the bottoms of two 9 inch round pans, or one 9 x 13 inch rectangular pan, with parchment paper.**In a mixing bowl, stir shortening to soften.  Sift in flour, baking powder, salt, and sugar.  Add 3/4 cup of the milk and the flavorings, and mix until all flour is dampened.  Beat well, with an electric mixer if possible.  Add unbeaten egg whites and remaining milk, and beat well.  Stir in nuts and cherries.  Pour batter into prepared pans.**Bake for 25 to 30 minutes.  Cool completely.  Fill and frost with Seven Minute Frosting, and decorate with additional maraschino cherry halves.**",7752,https://images.media-allrecipes.com/images/79591.png
Nectar Kake Recipe ,1,Linda Thrasher,X,X,X,"cake,apricot,egg,lemon,lemon,vegetable oil,vanilla,lemon juice,sugar,sugar","^Preheat oven to 325 degrees F (165 degrees C).  Grease a tube pan.**In a large bowl, mix dry cake mix and gelatin.  Add apricot nectar and oil, mixing well.  Beat in eggs, one at a time.  Stir in vanilla and lemon flavoring.  Pour batter into greased tube pan.**Bake for 55 minutes.  Cool.**Mix lemon juice and confectioners^^ sugar.  Pour glaze over cooled cake.  Dust with powered sugar.**^",7755,https://images.media-allrecipes.com/userphotos/250x250/970228.jpg
Watergate Cake II Recipe ,10,Bev,X,X,X,"cake,egg,vegetable oil,lemon,pistachio,coconut,pecan,whipped topping mix,milk,pistachio,walnut,coconut","Mix cake mix, oil, eggs, soda drink, and 1 package pudding well, about 5 minutes.  Fold in coconut and nuts.  Pour into greased and floured 9 x 13 inch pan.**Bake at 350 degrees F (175 degrees C) for 45 minutes.  Cool.**To Make Icing:  Combine dream whip, milk, and 1 package pudding.  Beat until thick.  Spread over cake.  Sprinkle nuts and coconut on top.**",7756,https://images.media-allrecipes.com/userphotos/250x250/249267.jpg
Zucchini Cake III Recipe ,133,Geri Knoll,X,X,X,"egg,white sugar,vegetable oil,flour,cinnamon,salt,baking powder,baking soda,pineapple,walnut,zucchini,vanilla,sugar,milk","^Preheat oven to 350 degrees F (175 degrees C).  Grease and flour a tube pan.**Sift together flour, cinnamon, salt, baking powder, and baking soda on to a piece of waxed paper.**In a large bowl, beat eggs and sugar until light colored.  Mix in oil.  Add sifted ingredients to egg mixture, and beat for 2 minutes.  Stir in pineapple, chopped nuts, vanilla, and zucchini.  Mix thoroughly.  Pour batter into prepared pan.**Bake for 80 minutes, or until tester inserted in the center of the cake comes out clean.  Cool for 30 minutes.**To Make Glaze:  In a small bowl, combine the confectioners^^ sugar and the milk.   When cake has cooled, pour glaze over cake.**^",7758,https://images.media-allrecipes.com/userphotos/560x315/41778.jpg
"Apple, Carrot, Or Zucchini Cake Recipe ",130,Carla A.,X,X,X,"apple,white sugar,egg,walnut,flour,cinnamon,nutmeg,salt,baking soda,vegetable oil","Preheat oven to 350 degrees F (175 degrees C).  Grease and flour a 9 X 13 inch pan.**In a large bowl, blend the sugar with the eggs.  Add the oil, and mix well.  Mix in flour, spices, salt, and baking soda.  Stir in the nuts and the apples, carrots, or zucchini.  Pour batter into prepared pan.**Bake for 40 minutes.  Serve warm or cooled.**",7760,https://images.media-allrecipes.com/userphotos/560x315/825066.jpg
Laurie Lundy Cake Recipe ,6,Laurie Lundy,X,X,X,"chocolate,walnut,coconut,cream cheese,butter,sugar","^Mix cake as directed on box.**Spread nuts and then coconut on the bottom of a greased 9 x 13 inch pan.  Pour cake batter over coconut.**Combine cream cheese and butter or margarine in a saucepan.  Heat over low heat until melted.  Stir in confectioners^^ sugar, and spoon over batter.**Bake at 350 degrees F (175 degrees C) for 45 minutes.**^",7761,https://images.media-allrecipes.com/userphotos/560x315/1087104.jpg
Chocolate Mocha Cake II Recipe ,4,Roxanne39,X,X,X,"shortening,white sugar,egg,flour,salt,baking powder,baking soda,coffee,cocoa powder","Preheat oven to 350 degrees F (175 degrees C). Grease and flour two 9 inch round cake pans.**Cream the sugar and the shortening together until light. Add the eggs, one at a time, beating well after each one.**Sift the flour, salt, baking soda, and baking powder together. Set aside.**Mix coffee and cocoa together until smooth. Add alternately with the flour mixture to the creamed mixture. Beat for 2 minutes then pour batter into the prepared pans.**Bake at 350 degrees F (175 degrees C) for 30 to 35 minutes. Frost when cooled.**",7762,https://images.media-allrecipes.com/images/79591.png
Greek Lemon Cake Recipe ,179,Carol,30 m,50 m,1 h 30 m,"flour,baking soda,salt,egg,white sugar,butter,lemon,lemon juice,yogurt","Preheat oven to 350 degrees F (175 degrees C). Grease one 10-inch tube pan.**Sift the flour, baking soda, and salt together. Set mixture aside.**In a large bowl, beat the egg whites until soft peaks form. Gradually add 1/2 cup of the sugar, beating until stiff glossy peaks form. Set aside.**Beat butter and remaining 1 1/2 cups sugar in a large bowl with an electric mixer until fluffy, 3 to 5 minutes. The mixture should be noticeably lighter in color.**Blend in egg yolks, lemon zest, and lemon juice. Add flour mixture alternately with the yogurt, mixing until combined. Gently fold in the egg whites and pour the batter into the prepared pan.**Bake in preheated oven until a tester inserted in the center comes out clean, 50 to 60 minutes. Let cake cool in pan for 10 minutes, then turn out onto a rack to finish cooling. Serves 12.**",7763,https://images.media-allrecipes.com/userphotos/560x315/1083096.jpg
Death By Chocolate I Recipe ,4,Sue Cauch,X,X,X,"chocolate,liqueur,chocolate,chocolate,topping thawed,chocolate","Preheat oven to 350 degrees F (175 degrees C). Grease and flour three 8 inch round cake pans.**Prepare cake mix according to package directions. Pour batter into the prepared pans.**Bake at 350 degrees F (175 degrees C) for 30 minutes. Let cake cool slightly then pierce cakes with a fork. Pour the coffee liqueur gradually over the three cake layers.**Prepare the chocolate mousse according to the package directions. Let chill in the refrigerator.**Once cake is cool break it into pieces. Layer cake pieces, chocolate mousse, crushed butter toffee candy bars, and whipped topping 1/3 at a time in a large glass bowl. Grate the chocolate candy bar over the top. Let chill in refrigerator for several hours before serving.**",7764,https://images.media-allrecipes.com/userphotos/250x250/515079.jpg
Death By Chocolate II Recipe ,16,Bev,X,X,X,"chocolate,liqueur,topping thawed,chocolate,milk,chocolate,almond","Bake cake according to package directions for one 9x13 inch cake. When cake is cool poke holes in the top and pour the coffee liqueur over it. Break up the cake into 1 inch cubes and set aside.**Mix the pudding mixes with the milk until thick.**In a large punch bowl layer  1/2 of the cake cubes, 1/2 of the pudding, 1/2 of the crushed candy bars, and 1/2 of the whipped topping. Repeat layers following the same order. Sprinkle top toasted almonds and any additional crushed butter toffee candy bars, if desired. Cover and refrigerate for several hours before serving.**",7765,https://images.media-allrecipes.com/userphotos/560x315/4460396.jpg
Fourteen K Carrot Cake Recipe ,24,Sue Bladt,X,X,X,"flour,baking powder,baking soda,salt,cinnamon,white sugar,vegetable oil,egg,carrot,pineapple,walnut,coconut","Preheat oven to 350 degrees F (175 degrees C). Grease and flour one 9x13 inch cake pan.**Mix together the flour, baking powder, baking soda, salt, ground cinnamon. Stir in the white sugar. Add the oil and the eggs and mix well. Stir in the carrots, pineapple, chopped nuts, and the coconut. Pour batter into the prepared pan.**Bake at 350 degrees F (175 degrees C) for 40 minutes or until a toothpick inserted in the center comes out clean.**",7767,https://images.media-allrecipes.com/userphotos/250x250/2058.jpg
Butterscotch Cake I Recipe ,45,Angie Mulholland,X,X,X,"cake,egg,butter,butter,white sugar,almond","Preheat oven to 350 degrees F (175 degrees C). Grease one 15 1/2 x 10 1/2 x 1 inch jelly roll pan.**Combine the cake mix, eggs, and butterscotch pudding. Spread the batter into the prepared pan and sprinkle with the butterscotch chips, white sugar, and slivered almonds.**Bake at 350 degrees F (175 degrees C) for 20 minutes. Enjoy!**",7768,https://images.media-allrecipes.com/userphotos/560x315/1030404.jpg
Soccer Ball Cake Recipe ,12,Tracy,45 m,1 h 15 m,3 h 15 m,"cake,vanilla,rice,white sugar","Heat oven to 350 degrees F (175 degrees C). Grease and flour one 2 1/2  to 3-quart ovenproof bowl. Place sugar in a bowl and stir in black food color until desired color is achieved. Set aside.**Prepare cake batter according to package directions. Pour batter into the prepared bowl and bake until a skewer inserted in the center comes out clean, about 1 hour and 15 minutes. Let cake cool for 15 minutes in the bowl then invert and let cake cool completely.**Once cake is completely cool, trim flat side of cake and place on a cake board. Trim edges into a ball shape. Frost with the white frosting. Next, using a toothpick, draw a pentagon in the center top of the cake. Surround the pentagon with five hexagons. Repeating to cover entire cake. Cover lines with black licorice cut into 1 1/2 inch pieces. Fill the pentagon shapes with black-colored white sugar.**",7769,https://images.media-allrecipes.com/userphotos/560x315/436441.jpg
Lemon Icing Recipe ,262,Carol,5 m,X,5 m,"butter,lemon juice,vanilla,sugar","^Combine the butter, lemon juice, vanilla, and confectioner^^s sugar and beat until light and fluffy. Add more confectioner^^s sugar, or lemon juice to adjust the consistency as needed.**^",7770,https://images.media-allrecipes.com/userphotos/250x250/835274.jpg
^Bride^^s Cake Recipe ^,3,Carol,X,X,X,"butter,flour,baking soda,mace,lemon juice,white sugar,vanilla,egg,salt,cream","Preheat oven to 300 degrees F (150 degrees C). Grease and flour three round tube pans, one 10 inch, one 8 inch, and one 5 inch.**Sift the flour, baking soda, ground mace, and 2 1/4 cups of the sugar into a large bowl.**Using your hands, rub in the butter into the flour mixture.**Separate the eggs. Add the lemon juice and the vanilla to the egg yolks and beat well. Add the egg yolk mixture a little at a time to the flour mixture using your hands to combine the ingredients.**In a large bowl whip the egg whites with the salt and the cream of tartar until stiff. Gradually beat in the remaining 2 1/4 cups of the sugar till the whites are very stiff and glossy. Fold in the beaten egg whites into the batter in four portions, folding in very gently with your hands until no white lumps are visible. Spoon batter into the prepared pans.**Bake at 300 degrees F (150 degrees C) for 2 1/2 hours for the 10 inch pan, 2 1/4 hours for the 8 inch pan, and 1 1/2 hours for the 5 inch pan. Cakes are done when they shrink from the sides of the pans. Remove the 5 inch cake from the oven and let stand in pan for one hour before turning out. When the 8 inch cake is done turn off the oven and let it stand for 1/2 hour more in oven, remove it then 15 minutes later remove the 10 inch cake. Let the 8 and 10 inch cakes stand on cooling rack for 1/2 hour before turning out. Allow cakes to cool overnight before frosting.  If the cake tiers are to be separated by pillars, the holes left by the tube pans may be covered by rounds of cardboard before they are iced.  Use Decorator Frosting and decorate as desired.**",7771,https://images.media-allrecipes.com/userphotos/250x250/207668.jpg
Ice Cream Cake Recipe ,7,Patsy,X,X,X,"cake,strawberry,sugar,cream cheese,strawberry","^Slice prepared Angel Food cake in half horizontally. Spread softened strawberry ice cream on bottom layer. Put top layer on top the ice cream. Freeze cake for 45 minutes to an hour.**Mix cream cheese and confectioner^^s sugar until light and fluffy.**About 15 minutes before serving, remove cake from freezer and spread the cream cheese mixture over top and sides. Garnish with fresh strawberries.**^",7772,https://images.media-allrecipes.com/userphotos/560x315/1038642.jpg
