Recipe_Name,Review_Count,Author,Prepare_Time,Cook_Time,Total_Time,Ingredients,Directions,RecipeID,Recipe_Photo
Watergate Cake IV Recipe ,32,JBS BOX,X,X,X,"cake,egg,vegetable oil,lemon,pistachio,topping thawed,milk","Combine cake mix, eggs, oil, soda drink and 1 box pistachio pudding.  Pour batter into a greased and floured 13 x 9 inch pan.**Bake at 350 degrees F (175 degrees C) for 30 to 40 minutes, or until a toothpick inserted into cake comes out clean.  Cool completely.**While cake is baking, mix 1 box pistachio pudding, whipped topping, and milk.  Chill.  Ice cooled cake with chilled frosting.**",8041,https://images.media-allrecipes.com/userphotos/250x250/215727.jpg
^Pig Pickin^^ Cake Recipe ^,218,teri,X,X,X,"cake,orange juice,egg,vegetable oil,topping thawed,pineapple,vanilla","Mix together cake mix, canned oranges with juice, eggs, and oil.  Pour batter into three greased and floured 8 inch round pans. Layers will be thin.**Bake at 350 degrees F (175 degrees C) for 25 to 30 minutes, or until cake tests done.  Cool layers on wire racks.**Mix together whipped topping, drained pineapple, and instant pudding mix.  Fill and frost the cooled cake.  Refrigerate until ready to eat.**",8043,https://images.media-allrecipes.com/userphotos/250x250/24197.jpg
Cakes In A Cone Recipe ,83,Sassy Squirrel,X,X,X,"cake,ice cream,chocolate,candy","Prepare cake mix according to directions.  Fill each cone about 3/4 full of batter, up to first ridge.  Place cones in the cups of a cupcake pan or on cookie sheets.**Bake at 400 degrees F (205 degrees C) for 15 to 18 minutes.**Place 10 chocolate chips on top of each warm cone, and in a minute or two spread melted chocolate  over top.  Decorate with candies.**",8045,https://images.media-allrecipes.com/userphotos/560x315/699139.jpg
Jam Cake Recipe ,4,Glenda,X,X,X,"flour,baking soda,salt,cinnamon,clove,pecan,raisin,shortening,white sugar,egg,blackberry,buttermilk,butter,cream cheese,sugar,vanilla","^Grease and flour two 8 or 9 inch round pans. Preheat oven to 350 degrees F (175 degrees C).**Mix flour with soda, salt, cinnamon, and cloves. Add nuts and raisins to dry ingredients if using.**In a separate bowl, cream shortening and sugar. Add eggs one at a time, beating continuously. Add jam. Add flour mixture alternately with milk. Pour batter into prepared pans.**Bake at 350 degrees F (175 degrees C) for 35 minutes. Cool, and frost with Cream Cheese Frosting.**To make Cream Cheese Frosting: mix together until creamy 1/4 cup butter, cream cheese, confectioners^^ sugar, and vanilla.**^",8046,https://images.media-allrecipes.com/userphotos/560x315/970596.jpg
Orange Cake Recipe ,665,Angie LaSala,30 m,1 h,2 h,"cake,lemon,orange juice,vegetable oil,egg,lemon,orange juice,white sugar,butter","Grease a 10 inch Bundt pan. Preheat oven to 325 degrees F (165 degrees C).**In a large bowl, stir together cake mix and pudding mix. Make a well in the center and pour in 3/4 cup orange juice, oil, eggs and lemon extract. Beat on low speed until blended. Scrape bowl, and beat 4 minutes on medium speed. Pour batter into prepared pan.**Bake in preheated oven for 50 to 60 minutes. Let cool in pan for 10 minutes, then turn out onto a wire rack and cool completely.**In a saucepan over medium heat, cook 1/3 cup orange juice, sugar and butter for two minutes. Drizzle over cake.**",8047,https://images.media-allrecipes.com/userphotos/560x315/5733352.jpg
Mystery Chocolate Cake Recipe ,45,Lenna Roe,X,X,X,"beet,vanilla,white sugar,vegetable oil,egg,flour,baking soda,salt,cocoa powder","Preheat oven to 350 degrees F (175 degrees C). Grease and flour one 9 x 13 inch pan.**In a large bowl, combine beets, eggs, vanilla, oil, and sugar. Mix with an electric mixer on low speed until well combined.**In a separate bowl, mix together flour, soda, salt, and cocoa. Add to the creamed mixture, beating together well.  Pour batter into prepared pan.**Bake for 25 to 30 minutes until done.  Cool and frost with your favorite icing.**",8049,https://images.media-allrecipes.com/userphotos/560x315/5892804.jpg
Rich and Chocolaty Syrup Cake Recipe ,10,Mike McCrady,10 m,45 m,55 m,"egg,vanilla,chocolate,vegetable oil,flour,white sugar",Preheat oven to 350 degrees F (175 degrees C).**Beat the eggs and the vanilla with a spoon. Blend in the chocolate syrup. Fill emptied chocolate syrup can with vegetable oil and add to bowl. Add the flour to bowl. Fill can with sugar and add to bowl. Stir well and pour into a lightly greased 9x13 inch pan.**Bake 40-45 minutes at 350 degrees F (175 degrees C). Ice after cooling or leave plain.**,8050,https://images.media-allrecipes.com/userphotos/250x250/230211.jpg
Four Egg Yellow Cake Recipe ,655,Carolyn,X,X,X,"shortening,white sugar,egg,vanilla,flour,baking powder,salt,milk","Preheat oven to 350 degrees F (175 degrees C).  Grease and flour one 9 x 13 inch pan.**Cream together shortening and sugar. Beat in eggs and vanilla.**In a separate bowl, combine flour, baking powder, and salt. Add to creamed mixture alternately with milk. Mix well. Pour batter into prepared pan.**Bake for 45 minutes, or until cake tests done.  Cool.**",8051,https://images.media-allrecipes.com/userphotos/560x315/644202.jpg
Applesauce Cake II Recipe ,7,Nicole Cama,X,X,X,"flour,white sugar,salt,baking powder,cinnamon,clove,spice,applesauce,water,shortening,egg,raisin,almond,egg,brown sugar,lemon juice,walnut","Preheat oven to 350 degrees F (175 degrees C). Grease and flour one 9x13 inch pan.**Beat flour, white sugar, salt, baking powder, cinnamon, cloves, allspice, applesauce, water, shortening, 2 eggs, raisins, and 1/2 cup chopped almonds with a mixer on low, scraping the bowl constantly, 30 seconds. Beat on high speed, scraping bowl occasionally, 3 minutes. Pour into prepared pan.**Bake at 350 degrees F (175 degrees C) until wooden pick inserted in center comes out clean, 60-65 minutes.**To Make Frosting: Just before cake is removed from the oven, beat egg whites until foamy. Beat brown sugar and lemon juice gradually into egg whites until stiff. Carefully spread over HOT cake. Sprinkle with nuts. Bake at 400 degrees F (205 degrees C) until brown, 8 to 10 minutes.**",8052,https://images.media-allrecipes.com/userphotos/250x250/342975.jpg
Sour Cream Bundt Cake Recipe ,59,Sue Smith,X,X,X,"cake,vanilla,sour cream,sugar","Make the batter following the directions on the box, EXCEPT replace 2 teaspoons water with an equal amount of vanilla.  Fold in sour cream.  Bake according to directions given for baking a bundt cake. Cool on rack, place on serving plate, and dust with confectioners sugar.**",8053,https://images.media-allrecipes.com/userphotos/250x250/73285.jpg
Fanny the Fish Recipe ,5,Robin,X,X,X,cake,"Start with a cooled 9-inch square cake. From one corner, measure 5 inches along one side and 5 1/2 inches along the other. Cut on a curve through the points. Divide this in half, cutting on a curve to make two fins. From opposite corner, measure 6 inches along sides, and cut on a curve for tail.**",8054,https://images.media-allrecipes.com/userphotos/560x315/16587.jpg
Pork,34,Lorrie Sterling,X,X,X,"white sugar,vegetable oil,egg,bake,flour,cinnamon,baking powder,baking soda,raisin,vanilla","Preheat oven to 325 degrees F (165 degrees C). Grease and flour five 16 ounce cans OR two 8 x 4 inch loaf pans.**In a large bowl, mix sugar, oil, eggs, and beans until smooth.**In a separate bowl combine flour, cinnamon, baking powder, and soda. Add to bean mixture, stirring just until combined. Stir in raisins and vanilla. Fill cans 2/3 full with batter, or divide batter into prepared loaf pans.**Place cans or pans on a baking sheet.  Bake for 45 to 50 minutes, or until a tester inserted in the center of the cake comes out clean.  Cool completely on wire racks before removing bread from cans or pans.**",8055,https://images.media-allrecipes.com/userphotos/250x250/61932.jpg
Pancakes Recipe ,404,Jan,X,X,X,"flour,milk,egg,vegetable oil","Beat eggs, oil, and milk together, and add to flour.  Stir until combined.**Heat a greased griddle until drops of water sprinkled on it evaporate noisily.  Pour 1/8 to 1/4 cup batter onto the griddle.  Turn over with a metal spatula when bubbles begin to form on top.  Cook second side to a golden brown color.**",8056,https://images.media-allrecipes.com/userphotos/560x315/4074772.jpg
Mocha Cake III Recipe ,7,Dawn Vassel,X,X,X,"chocolate,egg,vegetable oil,sour cream,liqueur,chocolate","Grease one 10 inch bundt cake pan. Preheat oven to 350 degrees F (175 degrees C).**Mix together cake mix, eggs, oil, sour cream, coffee liqueur, and chocolate chips, in the order listed, and pour into the greased bundt cake pan.**Bake at 350 degrees F (175 degrees C) for one hour or until the surface springs back when touched lightly.**",8057,https://images.media-allrecipes.com/userphotos/250x250/446207.jpg
Ooey Goey Cake Recipe ,41,Kenneth Massey,X,X,X,"cake,butter,egg,cream cheese,egg,sugar","^Grease and flour one 13x9 inch pan. Preheat oven to 350 degrees F (175 degrees C).**Mix together cake mix, melted butter, and 1 egg. Press into prepared pan.**In separate bowl mix cream cheese, 2 eggs, and confectioners^^ sugar. Pour over first layer.**Bake at 350 degrees F (175 degrees C) for 40 minutes.**^",8058,https://images.media-allrecipes.com/userphotos/560x315/1549252.jpg
Popcorn Cake II Recipe ,12,AUTUMN/FALL,20 m,5 m,30 m,"corn,gumdrop,peanut,marshmallow,butter",Butter one 10 inch tube or bundt pan.**Toss the popcorn with the gumdrops and cashews.**Melt the marshmallows with the butter or margarine. Pour over the popcorn mixture and mix well. Press the mixture into the prepared pan. Butter hands before pressing firmly into pan. Chill and remove from pan.**,8059,https://images.media-allrecipes.com/userphotos/560x315/1039853.jpg
Passover Sponge Cake (Plava) Recipe ,3,Shirlee Finn,X,X,X,"egg,egg,sugar,lemon juice,potato,cake",^Beat whites until stiff.  Beat in confectioners^^ sugar.  Beat together yolks and lemon juice: fold yolk mixture into egg whites.  Fold in potato flour and matzo meal.  Pour batter into ungreased tube pan.**Bake at 375 degrees F (190 degrees C) for approximately 1 hour.**^,8060,https://images.media-allrecipes.com/images/79591.png
Ice Cream Cone Treats Recipe ,135,Dee Akeson,X,X,X,"cake,vanilla,candy","Prepare cake mix batter according to directions, or make any standard cake recipe batter (i.e. white, chocolate, etc.).**Place flat-bottomed ice cream cones in the cups of a regular muffin pan. Pour enough batter into each cone to fill from 1/2 to 2/3 full.**Bake at time and temperature as recommended for cupcakes. After they have cooled, frost with your favorite canned or home-prepared frosting recipe. Decorate with sprinkles or other decorations of your choice.**",8062,https://images.media-allrecipes.com/userphotos/560x315/429898.jpg
Cake Mixes from Scratch and Variations Recipe ,646,Janet,20 m,35 m,55 m,"flour,baking powder,salt,white sugar,shortening,egg,milk,vanilla","For a Yellow Cake: Sift together flour, baking powder, salt, and sugar. Cut in shortening until fine crumbs are formed. Add eggs, milk, and vanilla. Beat at low speed for 1 minute, then high for 2 minutes, scraping the bowl frequently.**Pour batter into greased and floured 9x13 inch pan. Bake in preheated 350 degree F oven (175 degrees C) for 25 to 30 minutes.**Variation for a White Cake: Prepare as for the basic cake except use 3 egg whites for the 2 whole eggs. Whites may be beaten separately and added for a lighter cake.**Variation for a Chocolate Cake: Add 1/4 cup cocoa powder to the basic cake mix prior to adding the milk.**Variation for a Spice Cake: Add 1 teaspoon cinnamon, 1/4 teaspoon ground cloves, and 1/4 teaspoon ground allspice to the basic cake mix.**Variation for a Pineapple Upside Down Cake: Melt 1/2 cup butter in the bottom of a 9x13 pan. Add 2/3 cup brown sugar, stirring into the butter. Arrange pineapple slices in the pan. Top with the basic (yellow cake) mix recipe. Bake 30 to 35 minutes, cool 5 minutes, and invert to serve.**",8063,https://images.media-allrecipes.com/userphotos/560x315/620309.jpg
Chocolate Cookie Cake Recipe ,1,JJOHN32,X,X,X,"butter,molasses,white sugar,chocolate,vanilla,raisin,almond,cherry","Put the butter or margarine, molasses, sugar, and chocolate into a 1-1/2 quart oven-proof glass bowl and microwave on high for two minutes or until fat and chocolate have melted. Stir well. Add the broken cookies or wafers, raisins, almonds, and cherries. Mix well to coat them with the chocolate mixture.**Place a 7 inch plain flan ring on a flat serving plate. Spoon in the cookie mixture. Press down evenly. Chill in refrigerator for about 8 hours or overnight. Remove flan ring and serve.**",8064,https://images.media-allrecipes.com/images/79591.png
^Poor Man^^s Cake II Recipe ^,2,Doreen MacKay,10 m,1 h 40 m,1 h 50 m,"water,brown sugar,raisin,lard,salt,cinnamon,nutmeg,clove,flour,baking soda,vanilla","Preheat oven to 350 degrees F (175 degrees C). Lightly grease one 9 x 13 inch pan.**Place cold water, brown sugar, raisins, lard, salt, cinnamon, nutmeg, and cloves in a large saucepan. Bring this combination to a boil.  Let simmer for a full 6 minutes, then allow mixture to cool to lukewarm. Set aside.**In small mixing bowl, combine flour and soda. Gradually add the dry ingredients to the cooled mixture. Add vanilla, and blend into batter. Pour batter into prepared pan.**Bake in the preheated oven for 90 to 120 minutes, or until a toothpick inserted into the center of the cake comes out clean. Allow to cool. Store for at least a week before cutting. This cake will remain moist for months.**",8065,https://images.media-allrecipes.com/images/79591.png
Heritage Jam Cake Recipe ,2,Barbara,30 m,1 h,1 h 30 m,"butter,white sugar,egg,baking soda,buttermilk,flour,salt,cinnamon,clove,spice,date,grape,pecan,fruit","Preheat oven to 350 degrees F (175 degrees C).  Grease two 9 inch, round cake pans, and line with parchment paper.**Combine 2 1/2 cups flour, salt, and spices.**Dissolve soda in buttermilk: stir well.**Cream butter or margarine.  Gradually add sugar, beating well.  Add eggs, one at a time, beating well after each addition.  Mix flour mixture into creamed mixture alternately with buttermilk mixture, beginning and ending with flour mixture.  Dredge dates and pecans in remaining 1/2 cup flour, and fold into batter.  Carefully fold grape jam into batter.  Pour batter into prepared pans.**Bake for 40 to 45 minutes, or until a wooden toothpick inserted in center comes out clean.  Cool in pans for 10 minutes.  Remove layers from pans, and cool completely.**Spread hot Kentucky Fruit Filling between the layers and on top of the cake.**",8068,https://images.media-allrecipes.com/userphotos/560x315/690421.jpg
Kentucky Fruit Filling Recipe ,1,Barbara,X,X,X,"date,raisin,orange,white sugar,orange juice","Cut orange into sections, and remove the seeds.  Grind the sections, peels and all.**Combine dates, raisins, and ground orange in a medium saucepan: stir well.  Stir in sugar and orange juice.  Cook over medium heat, stirring constantly, until mixture is thickened.**Spread hot filling between layers or on top of cake.**",8069,https://images.media-allrecipes.com/userphotos/560x315/690425.jpg
Blackberry Jam Cake I Recipe ,12,Barbara,X,X,X,"butter,white sugar,egg,baking soda,buttermilk,flour,baking powder,salt,cocoa powder,cinnamon,spice,blackberry,sugar,milk,butter,vanilla","^Combine flour, baking powder, salt, cocoa, cinnamon, and allspice.**Dissolve soda in buttermilk, stirring well.**Cream butter or margarine and sugar, beating well.  Add egg yolks, beating mixture well.  Mix flour mixture into the creamed mixture alternately with the buttermilk mixture, beginning and ending with flour mixture.  Fold in blackberry jam.  Pour batter into a greased and floured 10 inch bundt pan.**Bake at 350 degrees F (175 degrees C) for 45 to 50 minutes, or until cake tests done.  Cool in pan for 15 minutes.  Remove from pan, and cool complete.**Combine  confectioners^^ sugar, milk, butter or margarine, and vanilla.  Beat until mixture is smooth.  Spoon over cooled cake**^",8070,https://images.media-allrecipes.com/userphotos/560x315/2140418.jpg
Five Flavor Pound Cake II Recipe ,72,Pauline,X,X,X,"butter,vegetable oil,egg,white sugar,flour,baking powder,salt,milk,coconut,rum,butter,lemon,vanilla,water,white sugar,almond","Preheat oven to 325 degrees F (165 degrees C).  Grease and flour a tube pan.**Sift the flour with the baking powder and salt.**Cream butter or margarine, oil, and sugar until fluffy.  Add eggs one at a time, beating well after each addition.  Mix in flour mixture alternately with milk, beginning and ending with flour.  Mix well. Stir in 1 teaspoon each coconut flavoring, butter flavoring, rum extract, lemon extract, and vanilla extract.  Pour batter into prepared pan.**Bake for 1 1/2 hours or until cake tests done.**In a small saucepan, combine water, sugar, and 1 teaspoon each coconut flavoring, butter flavoring, rum extract, vanilla extract, and almond extract.  Boil until the sugar has dissolved completely.  Spoon over hot cake.  Cool cake.**",8074,https://images.media-allrecipes.com/userphotos/560x315/37643.jpg
Mincemeat Cake Recipe ,6,Barbara,X,X,X,"butter,white sugar,egg,baking soda,buttermilk,flour,meat,caramel","Preheat oven to 300 degrees F (150 degrees C).  Grease and flour two 8 inch, round, cake pans.**Cream butter or margarine in a large mixing bowl.  Gradually add sugar, beating well.  Add eggs one at a time, beating mixture well after each addition.**Dissolve soda in buttermilk, stirring well.  Mix flour into creamed mixture alternately with buttermilk mixture, beginning and ending with flour.  Mix well after addition.  Stir in crumbled mincemeat.  Spoon batter into prepared pans.**Bake for 45 to 50 minutes, or until a wooden pick inserted in center comes out clean.  Cool cake in pan for 10 minutes.  Remove layers from pans, and cool completely.  Fill and frost the cake with Caramel Cream Frosting.**",8075,https://images.media-allrecipes.com/userphotos/560x315/5102646.jpg
Caramel Cream Frosting Recipe ,9,Barbara,X,X,X,"white sugar,white sugar,butter,whipping cream","Place 2 tablespoons sugar in a saucepan.  Cook over medium heat until sugar is dissolved and becomes golden brown in color.  Set aside.**Combine remaining 1 cup sugar, butter, and cream in a medium saucepan.  Cook over medium heat, stirring constantly, until mixture comes to a boil.  Stir in caramelized sugar, and return to a boil.  Cook for 2 minutes, stirring constantly.  Remove from heat.  Beat until frosting has a good spreading consistency.**",8076,https://images.media-allrecipes.com/images/79591.png
Italian Creme Layer Cake Recipe ,187,Barbara,30 m,30 m,1 h 30 m,"buttermilk,baking soda,white sugar,butter,vegetable oil,shortening,egg,vanilla,egg,flour,coconut,pecan,cream cheese,margarine,sugar,vanilla,pecan","^Preheat oven to 325 degrees F (165 degrees C).  Grease three 9 inch, round cake pans. Combine soda and buttermilk, and let stand a few minutes.**In a large bowl, cream sugar, 1/2 cup butter, 1/2 cup oil and shortening.  Add egg yolks one at a time, beating well after each addition. Mix buttermilk mixture alternately with flour into creamed mixture.  Stir in 1 teaspoon vanilla.**In a large glass or metal mixing bowl, beat egg whites until stiff peaks form. Fold 1/3 of the whites into the batter, then quickly fold in remaining whites until no streaks remain. Gently stir in 1 cup pecans and coconut.**Pour batter into prepared pans. Bake in the preheated oven for 25 to 30 minutes, or until a toothpick inserted into the center of the cake comes out clean. Allow to cool.**To make the Cream Cheese Frosting:   Beat together cream cheese, 1/2 cup butter or margarine, 1 teaspoon vanilla, and confectioners^^ sugar.  Stir in 1 cup chopped pecans.  Frost and fill cooled cake with cream cheese frosting.**^",8078,https://images.media-allrecipes.com/userphotos/250x250/512896.jpg
Amazing Corn Cake Recipe ,24,LOIS JEAN ANDERSON,20 m,30 m,50 m,"cream,brown sugar,white sugar,egg,vegetable oil,baking powder,flour,baking soda,salt,cinnamon,raisin,walnut","Stir together flour, baking powder, baking soda, cinnamon, and salt.**In a mixing bowl, combine corn and sugars.  Beat in eggs and oil till well blended.  Mix flour mixture into batter.  Stir in raisins and nuts.  Pour batter into greased 9 x 13 inch pan.**Bake at 350 degrees F (175 degrees C) for 30 to 35 minutes, or till cake tests done.  Cool.**",8080,https://images.media-allrecipes.com/userphotos/250x250/3060.jpg
German Chocolate Sauerkraut Cake Recipe ,14,Janice,X,X,X,"butter,white sugar,egg,vanilla,cocoa powder,flour,baking powder,baking soda,salt,water,sauerkraut","Preheat oven to 350 degrees F (175 degrees C). Grease and flour two 8-inch pans, round or square.**Thoroughly cream together butter and sugar. Beat in eggs and vanilla.**Sift together cocoa, flour, baking powder, soda, and salt, and add alternately with water to egg mixture. Stir in the sauerkraut. Pour batter into prepared pans.**Bake at 350 degrees F (175 degrees C) for 30 minutes or until a wooden pick comes out clean. Frost with your favorite chocolate or white frosting.**",8081,https://images.media-allrecipes.com/userphotos/250x250/667256.jpg
Mini Cheesecakes II Recipe ,86,Mercedes,20 m,25 m,1 h 45 m,"vanilla,cream cheese,white sugar,vanilla,egg","Preheat oven to 325 degrees F (165 degrees C).**Line muffin tin with foil liners. Place 1 vanilla wafer in each liner.**Mix cream cheese, vanilla, and sugar with an electric mixer on medium speed until well blended. Add eggs, and mix well. Pour over wafers, filling 3/4 full.**Bake in preheated oven for 25 minutes or until set. Remove from pan when cool. Chill before serving.**",8083,https://images.media-allrecipes.com/userphotos/560x315/963227.jpg
Gooey Butter Cake III Recipe ,381,Barbara,X,X,X,"cake,butter,egg,vanilla,cream cheese,egg,vanilla,sugar","^Preheat oven to 350 degrees F (175 degrees C).**Mix cake mix, melted butter or margarine, 1 teaspoon vanilla, and 2 eggs with a spoon.  Pat into a 9 X 13 inch pan.**Mix cream cheese, 2 eggs, and 1 teaspoon vanilla with an electric mixer.  Slowly beat in confectioner^^s sugar.  Pour over cake layer.**Bake for 40 to 45 minutes. Cool.**^",8088,https://images.media-allrecipes.com/userphotos/560x315/1105575.jpg
Chess Cake Recipe ,130,Kathy Bliesner,30 m,1 h,1 h 30 m,"cake,egg,butter,cream cheese,butter,egg,sugar","^Preheat oven to 325 degrees F (165 degrees C).  Grease and flour one 9 x 13 inch pan.**In a large bowl, mix together cake mix, 2 eggs, and 1/2 cup melted butter.  Put into prepared pan.**In another bowl, Beat cream cheese until smooth. Blend in 1/2 cup melted butter and 2 eggs. Gradually beat in the confectioner^^s sugar. Pour over the crust mixture already in the pan.**Bake for 1 hour.  Cool.**^",8089,https://images.media-allrecipes.com/userphotos/250x250/60169.jpg
Red Velvet Cake III Recipe ,158,Mary,X,X,X,"cake,vanilla,egg,food coloring,vegetable oil,water,vinegar,cocoa powder,milk,cream cheese,vanilla,topping thawed","Preheat oven to 350 degrees F (175 degrees C).  Grease and flour one 9 x 13 inch pan.**Mix together cake mix, 1 box pudding mix, eggs, oil, food coloring, water, vinegar, and cocoa. Pour into prepared pan.**Bake at 350 degrees F (175 degrees C) for 35 to 40 minutes.  Cool.**Beat together milk and cream cheese.  Mix in 1 box pudding mix.  Fold in whipped topping.  Spread on cooled cake.  Refrigerate.**",8090,https://images.media-allrecipes.com/userphotos/560x315/555738.jpg
Ho Ho Cake Recipe ,92,Olene Grieshop,X,X,X,"chocolate,flour,milk,white sugar,margarine,shortening,margarine,vanilla,egg,water,chocolate,sugar","^Prepare and bake cake as directed on the package for a 9 x 13 inch pan.  Cool completely.**Combine flour and milk in saucepan.  Cook, stirring constantly, until thick.  Cool completely.  Cream 1 cup sugar, 1/2 cup margarine, and shortening.  Add cooled milk mixture, and beat well.  Spread over cake. Refrigerate.**In a small bowl, beat egg.  Stir in vanilla, melted chocolate, hot water, confectioner^^s sugar, and 1/2 cup margarine.  Pour over second layer.  Refrigerate.**^",8091,https://images.media-allrecipes.com/userphotos/250x250/353773.jpg
Hawaiian Wedding Cake I Recipe ,68,Olene Grieshop,X,X,X,"white sugar,baking soda,flour,egg,pineapple,walnut,coconut","Preheat oven to 350 degrees F (175 degrees C).  Grease one 9 x 13 inch pan.**In a large bowl, mix sugar, soda, and flour by hand.  Mix in eggs, pineapple with juice.  Stir in nuts, and coconut.  Pour into prepared pan.**Bake for 35 to 40 minutes.  Cool on wire racks.**",8092,https://images.media-allrecipes.com/userphotos/560x315/3025262.jpg
Japanese Fruit Cake I Recipe ,2,Cathy,50 m,25 m,1 h 15 m,"butter,white sugar,egg,vanilla,flour,baking powder,salt,milk,clove,cinnamon,spice,raisin,almond,orange,orange juice,coconut,white sugar,water,cornstarch,nut","Preheat oven to 325 degrees F (165 degrees C).  Grease and flour three 9 inch round cake pans.**Cream together butter, 2 cups sugar, eggs, and vanilla.**Sift together flour, baking powder, and salt.  Add flour mixture alternately with milk into egg mixture. Divide batter into 3 parts.  Fill  two pans with plain batter.  Add spices, raisins, and nuts into remaining batter, and pour batter into third pan.**Bake for 25 minutes, or until done.  Cool layers on wire racks.**Mix together orange juice and rind, 2 cups coconut, 2 cups sugar, boiling water, and cornstarch in a 2 quart pan.  Bring to a boil, and cook until mixture falls in lumps from a spoon.  Put layers together with filling, placing spiced layer in the center.  Ice cake with Seven Minute Frosting, and cover with remaining coconut.**",8093,https://images.media-allrecipes.com/images/79591.png
